{
  "$schema": "https://raw.githubusercontent.com/gruncellka/porto-data/refs/heads/main/porto_data/schemas/marks.schema.json",
  "file_type": "marks",
  "unit": {
    "dimension": "mm"
  },
  "default_profile": "domestic",
  "placement": {
    "envelopes": {
      "DL": {
        "x": 146,
        "y": 0,
        "width": 74,
        "height": 38
      },
      "C6": {
        "x": 88,
        "y": 0,
        "width": 74,
        "height": 38
      },
      "C5": {
        "x": 155,
        "y": 0,
        "width": 74,
        "height": 38
      },
      "C4": {
        "x": 250,
        "y": 0,
        "width": 74,
        "height": 38
      },
      "B4": {
        "x": 279,
        "y": 0,
        "width": 74,
        "height": 38
      }
    }
  },
  "profiles": [
    {
      "id": "domestic",
      "type": "stamp",
      "label": "WebStamp domestic",
      "description": "Domestic WebStamp franking graphic",
      "scope_notes": "Nominal footprint; registered WebStamp uses same size as domestic until measured separately",
      "size": {
        "width": 40,
        "height": 40
      },
      "mime_type": [
        "application/pdf",
        "image/png"
      ]
    },
    {
      "id": "international",
      "type": "stamp",
      "label": "WebStamp international",
      "description": "International WebStamp franking graphic",
      "scope_notes": "Same as domestic; registered WebStamp uses same size until measured separately",
      "size": {
        "width": 40,
        "height": 40
      },
      "mime_type": [
        "application/pdf",
        "image/png"
      ]
    }
  ]
}
