{
  "$schema": "https://raw.githubusercontent.com/gruncellka/porto-data/refs/heads/main/porto_data/schemas/marks.schema.json",
  "file_type": "marks",
  "unit": {
    "dimension": "mm"
  },
  "default_profile": "domestic",
  "profiles": [
    {
      "id": "domestic",
      "type": "label",
      "label": "Shipment label PDF",
      "description": "Standard Ukrposhta eCom sticker PDF for letters and documents",
      "scope_notes": "Domestic and international letters share one label model (A5-class PDF from API)",
      "size": {
        "width": 148,
        "height": 210
      },
      "mime_type": [
        "application/pdf"
      ]
    }
  ]
}
