{
  "$schema": "https://raw.githubusercontent.com/gruncellka/porto-data/refs/heads/main/porto_data/schemas/marks.schema.json",
  "file_type": "marks",
  "unit": {
    "dimension": "mm"
  },
  "default_profile": "domestic",
  "profiles": [
    {
      "id": "domestic",
      "type": "label",
      "label": "Mon Timbre en ligne domestic",
      "description": "MTEL stamp label for France and Outre-mer",
      "scope_notes": "Nominal Avery L7159 label 63.5×33.9 mm; registered MTEL uses same stamp size (no separate profile until measured) plus paper liasse",
      "size": {
        "width": 64,
        "height": 34
      },
      "mime_type": [
        "application/pdf"
      ]
    },
    {
      "id": "international",
      "type": "label",
      "label": "Mon Timbre en ligne international",
      "description": "MTEL stamp label for international destinations",
      "scope_notes": "Same label dimensions as domestic; international registered MTEL discontinued online",
      "size": {
        "width": 64,
        "height": 34
      },
      "mime_type": [
        "application/pdf"
      ]
    }
  ]
}
